{
  "version": "1.0",
  "essayId": "song-no-singer",
  "title": "The Song With No Singer",
  "centralClaim": "A person, observer, memory, or song is real as a conditioned and transformable pattern, while suffering intensifies when one local enactment claims independent ownership; recognition loosens that claim and becomes compassionate coordination among partial worlds.",
  "sourceUnitCount": 477,
  "continuityCandidates": [
    {
      "id": "relational-song",
      "meaning": "The essay's invariant pattern: real only through transformations, never owned by one performance.",
      "firstBeat": "song-001",
      "development": "Track this conserved meaning through 13 argumentative beats as its relation, scale, and consequence change.",
      "resolution": "Resolve it in song-088: There is no final singer outside the performance; the closing invariant is relation becoming able to recognize its own participation."
    },
    {
      "id": "local-interface",
      "meaning": "The operationally real boundary through which a finite perspective selects and acts.",
      "firstBeat": "song-006",
      "development": "Track this conserved meaning through 14 argumentative beats as its relation, scale, and consequence change.",
      "resolution": "Resolve it in song-084: This life neither owns the music nor stands apart from its conditions, yet its exact performance could occur nowhere else."
    },
    {
      "id": "dependency-field",
      "meaning": "The enabling network that prevents any participant from becoming an isolated source.",
      "firstBeat": "song-004",
      "development": "Track this conserved meaning through 14 argumentative beats as its relation, scale, and consequence change.",
      "resolution": "Resolve it in song-086: Recognition sees the relational network without installing an independent owner at its centre."
    },
    {
      "id": "ownership-knot",
      "meaning": "The extra claim that a local self owns, originates, or must permanently secure the process.",
      "firstBeat": "song-009",
      "development": "Track this conserved meaning through 21 argumentative beats as its relation, scale, and consequence change.",
      "resolution": "Resolve it in song-085: The final birthday gesture releases the ownership knot so a bounded performance can listen while it continues."
    },
    {
      "id": "memory-trace",
      "meaning": "The past surviving as a transformed constraint interpreted by a changed receiver.",
      "firstBeat": "song-025",
      "development": "Track this conserved meaning through 10 argumentative beats as its relation, scale, and consequence change.",
      "resolution": "Resolve it in song-083: Temporal identity is a relay in which changing selves inherit, interpret, and transmit constraints."
    },
    {
      "id": "listening-current",
      "meaning": "Recognition becoming ethical coordination among partial local worlds.",
      "firstBeat": "song-015",
      "development": "Track this conserved meaning through 8 argumentative beats as its relation, scale, and consequence change.",
      "resolution": "Resolve it in song-087: Compassion is recognition propagated across genuinely different perspectives through deliberate dependent origination."
    },
    {
      "id": "open-frontier",
      "meaning": "The unresolved disagreement about reflexive manifestation and final ground.",
      "firstBeat": "song-052",
      "development": "Track this conserved meaning through 8 argumentative beats as its relation, scale, and consequence change.",
      "resolution": "Resolve it in song-081: The disciplined function of myth is to sustain an open question without disguising premature closure as knowledge."
    }
  ],
  "beats": [
    {
      "id": "song-001",
      "sourceUnits": [
        1,
        4
      ],
      "sourceUnitTypes": [
        "quotation"
      ],
      "spokenWordCount": 55,
      "chapter": "Prologue · Four Starting Coordinates",
      "argumentRole": "hook",
      "claim": "The essay begins where four traditions converge on conditioned appearing without yet resolving its ultimate ground.",
      "relationType": "emergence",
      "sourceState": "many uncoordinated local processes",
      "targetState": "a provisional larger-scale centre",
      "preserves": "the plurality of the contributing processes",
      "whyNow": "This opening beat establishes the cross-tradition coordinates required by the essay's first question.",
      "misreadRisk": "The image could be mistaken for a decorative icon or a metaphysical object existing separately from the narrated relation.",
      "visualExclusions": [
        "Render the relation as changing geometry; do not substitute a literal stock illustration or place the whole claim on screen."
      ]
    },
    {
      "id": "song-002",
      "sourceUnits": [
        5,
        8
      ],
      "sourceUnitTypes": [
        "prose"
      ],
      "spokenWordCount": 50,
      "chapter": "Preamble · Happy Birthday",
      "argumentRole": "question",
      "claim": "A song cannot be reduced to one instrument or one transient acoustic event.",
      "relationType": "identity-across-change",
      "sourceState": "material and surface form change",
      "targetState": "one relational pattern remains recognizable",
      "preserves": "the invariant relational skeleton",
      "whyNow": "This beat follows \"Four Coordinates\" by moving from hook to question while advancing the essay's next stated relation.",
      "misreadRisk": "The image could be mistaken for a decorative icon or a metaphysical object existing separately from the narrated relation.",
      "visualExclusions": [
        "Render the relation as changing geometry; do not substitute a literal stock illustration or place the whole claim on screen."
      ]
    },
    {
      "id": "song-003",
      "sourceUnits": [
        9,
        10
      ],
      "sourceUnitTypes": [
        "prose"
      ],
      "spokenWordCount": 30,
      "chapter": "Preamble · Happy Birthday",
      "argumentRole": "objection",
      "claim": "Treating notation or an imagined perfect performance as the song simply relocates the mistaken container.",
      "relationType": "containment",
      "sourceState": "a field without a privileged interior",
      "targetState": "an operational inside and outside",
      "preserves": "the field on both sides of the boundary",
      "whyNow": "This beat follows \"Where Is the Song?\" by moving from question to objection while advancing the essay's next stated relation.",
      "misreadRisk": "The image could be mistaken for a decorative icon or a metaphysical object existing separately from the narrated relation.",
      "visualExclusions": [
        "Render the relation as changing geometry; do not substitute a literal stock illustration or place the whole claim on screen."
      ]
    },
    {
      "id": "song-004",
      "sourceUnits": [
        11,
        14
      ],
      "sourceUnitTypes": [
        "prose",
        "quotation",
        "list"
      ],
      "spokenWordCount": 70,
      "chapter": "Preamble · Happy Birthday",
      "argumentRole": "mechanism",
      "claim": "Performances, memories, expectations, and possible transformations coordinate the song without a central owner.",
      "relationType": "coordination",
      "sourceState": "many locally active systems",
      "targetState": "a shared response without erased difference",
      "preserves": "the agency of each contributor",
      "whyNow": "This beat follows \"No Hidden Container\" by moving from objection to mechanism while advancing the essay's next stated relation.",
      "misreadRisk": "The image could be mistaken for a decorative icon or a metaphysical object existing separately from the narrated relation.",
      "visualExclusions": [
        "Render the relation as changing geometry; do not substitute a literal stock illustration or place the whole claim on screen."
      ]
    },
    {
      "id": "song-005",
      "sourceUnits": [
        15,
        19
      ],
      "sourceUnitTypes": [
        "prose"
      ],
      "spokenWordCount": 45,
      "chapter": "Preamble · Happy Birthday",
      "argumentRole": "thesis",
      "claim": "The song is the recognizable invariant across performances, not a hidden object behind them.",
      "relationType": "identity-across-change",
      "sourceState": "material and surface form change",
      "targetState": "one relational pattern remains recognizable",
      "preserves": "the invariant relational skeleton",
      "whyNow": "This beat follows \"One Pattern, Many Voices\" by moving from mechanism to thesis while advancing the essay's next stated relation.",
      "misreadRisk": "The image could be mistaken for a decorative icon or a metaphysical object existing separately from the narrated relation.",
      "visualExclusions": [
        "Render the relation as changing geometry; do not substitute a literal stock illustration or place the whole claim on screen."
      ]
    },
    {
      "id": "song-006",
      "sourceUnits": [
        20,
        23
      ],
      "sourceUnitTypes": [
        "prose"
      ],
      "spokenWordCount": 69,
      "chapter": "Preamble · Happy Birthday",
      "argumentRole": "definition",
      "claim": "An instrument actively selects which version of the pattern can occur through its particular capacities and limits.",
      "relationType": "interface",
      "sourceState": "an undivided surrounding field",
      "targetState": "selective access through a local boundary",
      "preserves": "the surrounding field and the boundary's operational reality",
      "whyNow": "This beat follows \"Invariant, Not Substance\" by moving from thesis to definition while advancing the essay's next stated relation.",
      "misreadRisk": "The image could be mistaken for a decorative icon or a metaphysical object existing separately from the narrated relation.",
      "visualExclusions": [